{
  "artifactType": "E14FourDetectorGeneratedCandidateManifest",
  "authorizations": {
    "candidateEvaluationAuthorized": false,
    "candidateFittingAuthorized": false,
    "candidateManifestMaterializationAuthorized": true,
    "candidateRankingAuthorized": false,
    "crossMechanismCompositionAuthorized": false,
    "featureTransformationAuthorized": false,
    "outerOosAuthorized": false,
    "promotionAuthorized": false
  },
  "candidateCount": 28,
  "candidateCountByMechanism": {
    "banking-credit": 4,
    "broad-market-repricing": 16,
    "cross-border-growth": 4,
    "funding-liquidity": 4
  },
  "candidateIds": [
    "e14-broad-40812f9e8d61",
    "e14-broad-d914f56e649b",
    "e14-broad-182327efc1c2",
    "e14-broad-aebcbf4855ea",
    "e14-broad-bb98047423d4",
    "e14-broad-1d3f9292459f",
    "e14-broad-61de85156660",
    "e14-broad-c4df5bb5e6de",
    "e14-broad-363f5cbd811e",
    "e14-broad-67724d37ba54",
    "e14-broad-7bcb8dbe826e",
    "e14-broad-b83cb89abefe",
    "e14-broad-61cde4fecf5c",
    "e14-broad-2070c166a646",
    "e14-broad-d7b2965a1fa7",
    "e14-broad-1a3f2a978c6b",
    "e14-banking-v2-747c479c4341",
    "e14-banking-v2-fafdbc5dab63",
    "e14-banking-v2-1eed8d4b188c",
    "e14-banking-v2-d7492ff66379",
    "e14-cross-border-v2-6b34d73b50ff",
    "e14-cross-border-v2-4c42c1cfbe69",
    "e14-cross-border-v2-1f3878befaac",
    "e14-cross-border-v2-877a406c802c",
    "e14-funding-v2-784c284a69d4",
    "e14-funding-v2-429e2f943f7f",
    "e14-funding-v2-b06890d7383a",
    "e14-funding-v2-1813610b438b"
  ],
  "candidates": [
    {
      "candidateId": "e14-broad-40812f9e8d61",
      "detectorId": "e14-broad-market-repricing-detector",
      "eligibility": {
        "matureScoringMonth": "1990-12-01",
        "observableHardNegativeEpisodeCount": 2,
        "observableHardNegativeEpisodeIds": [
          "brexit-contained-transmission-2016",
          "regional-bank-stress-2023"
        ],
        "observablePositiveEpisodeCount": 6,
        "observablePositiveEpisodeIds": [
          "china-eme-stress-2015-2016",
          "euro-sovereign-stress-2011",
          "mexico-bond-turbulence-1994",
          "risk-repricing-2018q4",
          "russia-ltcm-1998",
          "taper-tantrum-2013"
        ],
        "plannedLeaveOneOutFoldCount": 6,
        "structurallyEligible": true
      },
      "featureBindings": [
        {
          "fitScope": "inner-only",
          "seriesId": "e14-baa10y-monthly-maximum",
          "sourceId": "fred-baa10y",
          "transform": "causal-rolling-percentile"
        }
      ],
      "identityPolicy": "preserved-exactly-from-candidate-manifest-v1",
      "lifecycleStatus": "research-generated-not-fit",
      "mechanism": "broad-market-repricing",
      "persistence": {
        "entryPersistenceMonths": 1,
        "hysteresisRequired": true,
        "recoveryPersistenceMonths": 1
      },
      "profile": {
        "aggregator": "identity",
        "profileId": "baa10y-only",
        "seriesIds": [
          "e14-baa10y-monthly-maximum"
        ]
      }
    },
    {
      "candidateId": "e14-broad-d914f56e649b",
      "detectorId": "e14-broad-market-repricing-detector",
      "eligibility": {
        "matureScoringMonth": "1990-12-01",
        "observableHardNegativeEpisodeCount": 2,
        "observableHardNegativeEpisodeIds": [
          "brexit-contained-transmission-2016",
          "regional-bank-stress-2023"
        ],
        "observablePositiveEpisodeCount": 6,
        "observablePositiveEpisodeIds": [
          "china-eme-stress-2015-2016",
          "euro-sovereign-stress-2011",
          "mexico-bond-turbulence-1994",
          "risk-repricing-2018q4",
          "russia-ltcm-1998",
          "taper-tantrum-2013"
        ],
        "plannedLeaveOneOutFoldCount": 6,
        "structurallyEligible": true
      },
      "featureBindings": [
        {
          "fitScope": "inner-only",
          "seriesId": "e14-baa10y-monthly-maximum",
          "sourceId": "fred-baa10y",
          "transform": "causal-rolling-percentile"
        }
      ],
      "identityPolicy": "preserved-exactly-from-candidate-manifest-v1",
      "lifecycleStatus": "research-generated-not-fit",
      "mechanism": "broad-market-repricing",
      "persistence": {
        "entryPersistenceMonths": 1,
        "hysteresisRequired": true,
        "recoveryPersistenceMonths": 2
      },
      "profile": {
        "aggregator": "identity",
        "profileId": "baa10y-only",
        "seriesIds": [
          "e14-baa10y-monthly-maximum"
        ]
      }
    },
    {
      "candidateId": "e14-broad-182327efc1c2",
      "detectorId": "e14-broad-market-repricing-detector",
      "eligibility": {
        "matureScoringMonth": "1990-12-01",
        "observableHardNegativeEpisodeCount": 2,
        "observableHardNegativeEpisodeIds": [
          "brexit-contained-transmission-2016",
          "regional-bank-stress-2023"
        ],
        "observablePositiveEpisodeCount": 6,
        "observablePositiveEpisodeIds": [
          "china-eme-stress-2015-2016",
          "euro-sovereign-stress-2011",
          "mexico-bond-turbulence-1994",
          "risk-repricing-2018q4",
          "russia-ltcm-1998",
          "taper-tantrum-2013"
        ],
        "plannedLeaveOneOutFoldCount": 6,
        "structurallyEligible": true
      },
      "featureBindings": [
        {
          "fitScope": "inner-only",
          "seriesId": "e14-baa10y-monthly-maximum",
          "sourceId": "fred-baa10y",
          "transform": "causal-rolling-percentile"
        }
      ],
      "identityPolicy": "preserved-exactly-from-candidate-manifest-v1",
      "lifecycleStatus": "research-generated-not-fit",
      "mechanism": "broad-market-repricing",
      "persistence": {
        "entryPersistenceMonths": 2,
        "hysteresisRequired": true,
        "recoveryPersistenceMonths": 1
      },
      "profile": {
        "aggregator": "identity",
        "profileId": "baa10y-only",
        "seriesIds": [
          "e14-baa10y-monthly-maximum"
        ]
      }
    },
    {
      "candidateId": "e14-broad-aebcbf4855ea",
      "detectorId": "e14-broad-market-repricing-detector",
      "eligibility": {
        "matureScoringMonth": "1990-12-01",
        "observableHardNegativeEpisodeCount": 2,
        "observableHardNegativeEpisodeIds": [
          "brexit-contained-transmission-2016",
          "regional-bank-stress-2023"
        ],
        "observablePositiveEpisodeCount": 6,
        "observablePositiveEpisodeIds": [
          "china-eme-stress-2015-2016",
          "euro-sovereign-stress-2011",
          "mexico-bond-turbulence-1994",
          "risk-repricing-2018q4",
          "russia-ltcm-1998",
          "taper-tantrum-2013"
        ],
        "plannedLeaveOneOutFoldCount": 6,
        "structurallyEligible": true
      },
      "featureBindings": [
        {
          "fitScope": "inner-only",
          "seriesId": "e14-baa10y-monthly-maximum",
          "sourceId": "fred-baa10y",
          "transform": "causal-rolling-percentile"
        }
      ],
      "identityPolicy": "preserved-exactly-from-candidate-manifest-v1",
      "lifecycleStatus": "research-generated-not-fit",
      "mechanism": "broad-market-repricing",
      "persistence": {
        "entryPersistenceMonths": 2,
        "hysteresisRequired": true,
        "recoveryPersistenceMonths": 2
      },
      "profile": {
        "aggregator": "identity",
        "profileId": "baa10y-only",
        "seriesIds": [
          "e14-baa10y-monthly-maximum"
        ]
      }
    },
    {
      "candidateId": "e14-broad-bb98047423d4",
      "detectorId": "e14-broad-market-repricing-detector",
      "eligibility": {
        "matureScoringMonth": "1994-12-01",
        "observableHardNegativeEpisodeCount": 2,
        "observableHardNegativeEpisodeIds": [
          "brexit-contained-transmission-2016",
          "regional-bank-stress-2023"
        ],
        "observablePositiveEpisodeCount": 6,
        "observablePositiveEpisodeIds": [
          "china-eme-stress-2015-2016",
          "euro-sovereign-stress-2011",
          "mexico-bond-turbulence-1994",
          "risk-repricing-2018q4",
          "russia-ltcm-1998",
          "taper-tantrum-2013"
        ],
        "plannedLeaveOneOutFoldCount": 6,
        "structurallyEligible": true
      },
      "featureBindings": [
        {
          "fitScope": "inner-only",
          "seriesId": "e14-vix-monthly-maximum",
          "sourceId": "cboe-vix-history",
          "transform": "causal-rolling-percentile"
        },
        {
          "fitScope": "inner-only",
          "seriesId": "e14-baa10y-monthly-maximum",
          "sourceId": "fred-baa10y",
          "transform": "causal-rolling-percentile"
        }
      ],
      "identityPolicy": "preserved-exactly-from-candidate-manifest-v1",
      "lifecycleStatus": "research-generated-not-fit",
      "mechanism": "broad-market-repricing",
      "persistence": {
        "entryPersistenceMonths": 1,
        "hysteresisRequired": true,
        "recoveryPersistenceMonths": 1
      },
      "profile": {
        "aggregator": "maximum",
        "profileId": "joint-maximum",
        "seriesIds": [
          "e14-vix-monthly-maximum",
          "e14-baa10y-monthly-maximum"
        ]
      }
    },
    {
      "candidateId": "e14-broad-1d3f9292459f",
      "detectorId": "e14-broad-market-repricing-detector",
      "eligibility": {
        "matureScoringMonth": "1994-12-01",
        "observableHardNegativeEpisodeCount": 2,
        "observableHardNegativeEpisodeIds": [
          "brexit-contained-transmission-2016",
          "regional-bank-stress-2023"
        ],
        "observablePositiveEpisodeCount": 6,
        "observablePositiveEpisodeIds": [
          "china-eme-stress-2015-2016",
          "euro-sovereign-stress-2011",
          "mexico-bond-turbulence-1994",
          "risk-repricing-2018q4",
          "russia-ltcm-1998",
          "taper-tantrum-2013"
        ],